{
  "$ref": "#/definitions/testimonials",
  "definitions": {
    "testimonials": {
      "type": "object",
      "properties": {
        "name": {
          "type": "string"
        },
        "role": {
          "type": "string"
        },
        "company": {
          "type": "string"
        },
        "content": {
          "type": "string"
        },
        "avatar": {
          "type": "string"
        },
        "lang": {
          "type": "string",
          "enum": ["en", "cs"],
          "default": "en"
        },
        "$schema": {
          "type": "string"
        }
      },
      "required": ["name", "role", "company", "content"],
      "additionalProperties": false
    }
  },
  "$schema": "http://json-schema.org/draft-07/schema#"
}
