{
  "name": "Jan Nov√°k",
  "role": "CEO",
  "company": "TechStartup s.r.o.",
  "content": "Exceptional work on our marketing. Increased our conversions by 40% and improved our online visibility. I recommend them to anyone looking for a reliable marketing partner.",
  "avatar": "https://images.unsplash.com/photo-1507003211169-0a1dd7228f2d?w=100&h=100&fit=crop",
  "lang": "en"
}
