{
  "name": "Marie Svobodov√°",
  "role": "CTO",
  "company": "Digital Agency a.s.",
  "content": "The AI integration they created for us transformed our customer service. Our team now processes 60% fewer routine inquiries thanks to the intelligent chatbot.",
  "avatar": "https://images.unsplash.com/photo-1494790108377-be9c29b29330?w=100&h=100&fit=crop",
  "lang": "en"
}
