{
  "name": "Petr Dvořák",
  "role": "Technical Director",
  "company": "Enterprise Solutions",
  "content": "Professional approach and technical mastery. The marketing automation implementation was seamless and our lead pipeline is now fully optimized.",
  "avatar": "https://images.unsplash.com/photo-1472099645785-5658abf4ff4e?w=100&h=100&fit=crop",
  "lang": "en"
}
